title,authors,url,session,abstract_takeaway
Trust3R: Unifying Feed-Forward Pointmap Prediction and Evidential Learning for Trust-Aware 3D Reconstruction,Zihao Zhu; Wenyuan Zhao; Nuo Chen; Chao Tian; Zhiwen Fan,https://icml.cc/virtual/2026/poster/66591,Poster Session 6,"Focuses on trust-aware reconstruction, trust3r unifying, unifying feed-forward, feed-forward pointmap, and pointmap prediction."
TurboGS: Accelerating 3D Gaussian Splatting via Error-Guided Sparse Pixel Sampling and Optimization,Zheng Dong; Daifei Qiu; Pinxuan Dai; Ke Xu; Jiamin Xu; Lili He; Rynson Lau; Weiwei Xu,https://icml.cc/virtual/2026/poster/62260,Poster Session 1,"Focuses on gaussian splatting, sparse pixel, pixel sampling, fine details, and turbogs accelerating."
Universal Skeleton Understanding via Differentiable Rendering and MLLMs,Ziyi Wang; Peiming Li; Xinshun Wang; Yang Tang; Kai-Kuang Ma; Mengyuan Liu,https://icml.cc/virtual/2026/poster/66218,,"Focuses on universal skeleton, skeleton understanding, understanding differentiable, differentiable rendering, and rendering mllms."
Unleashing the Representational Power of Fourier Shapes for Attacking Infrared Object Detection,Yixing Yong; Jian Wang; Ming Lei; Lijun He; Fan Li,https://icml.cc/virtual/2026/poster/65327,Poster Session 5,"Focuses on fourier shapes, infrared object, object detection, unleashing representational, and representational power."
Video-BCI: Bayesian Cognitive Integration of Self-Prior Hypotheses for Video Understanding,Xing Xi; Yu Qiu; Ronghua Luo; Peixian Chen; peilin tong; Jiahao Liang,https://icml.cc/virtual/2026/poster/61353,Poster Session 7,"Focuses on bayesian cognitive, self-prior hypotheses, video-bci bayesian, cognitive integration, and integration self-prior."
VideoBrain: Learning Adaptive Frame Sampling for Long Video Understanding,Junbo Zou; Ziheng Huang; Shengjie Zhang; Liwen Zhang; Weining Shen,https://icml.cc/virtual/2026/poster/66676,Poster Session 6,"Focuses on long video, video understanding, videobrain adaptive, adaptive frame, and frame sampling."
VideoLoom: A Video Large Language Model for Joint Spatial-Temporal Understanding,Jiapeng Shi; junke Wang; Zuyao You; Bo He; Zuxuan Wu,https://icml.cc/virtual/2026/poster/65229,Poster Session 1,"Focuses on joint spatial-temporal, video large, spatial-temporal understanding, video llms, and temporal spatial."
VideoSEAL: Separating Planning from Answer Authority for Agentic Long Video Understanding,Chenhao Qiu; Yechao Zhang; Xin Luo; Shien Song; Xusheng Liu,https://icml.cc/virtual/2026/poster/64001,Poster Session 2,"Focuses on planning answer, answer authority, long video, videoseal separating, and separating planning."
VideoVeritas: AI-Generated Video Detection via Perception Pretext Reinforcement Learning,Hao Tan; jun lan; Senyuan Shi; Zichang Tan; Zijian Yu; Huijia Zhu; Weiqiang Wang; Jun Wan; Zhen Lei,https://icml.cc/virtual/2026/poster/61929,Poster Session 1,"Focuses on perception pretext, pretext reinforcement, videoveritas ai-generated, ai-generated video, and video detection."
VIP: Visual-guided Prompt Evolution for Efficient Dense Vision-Language Inference,Hao Zhu; Shuo Jin; Wenbin Liao; Jiayu Xiao; Yan Zhu; Siyue Yu; Feng Dai,https://icml.cc/virtual/2026/poster/65184,Poster Session 8,"Focuses on dino txt, visual-guided prompt, prompt evolution, text queries, and vip visual-guided."
Vision in One Vector: Implicit Visual Compression with Diffusion Foundation Models,Jiajun He; Zongyu Guo; Zhaoyang Jia; Xiaoyi Zhang; Jiahao Li; Xiao Li; Bin Li; Jose Miguel Hernandez-Lobato; Yan Lu,https://icml.cc/virtual/2026/poster/62666,Poster Session 8,"Focuses on visual compression, visual generative, implicit representations, vision vector, and vector implicit."
VisionPulse: Dynamic Visual Sparsity for Efficient Multimodal Reasoning,Hengbo Xu; Shengjie Jin; Yanbiao Ma; Zhiwu Lu,https://icml.cc/virtual/2026/poster/65976,Poster Session 1,"Focuses on visual tokens, visual evidence, during reasoning, visual sparsity, and redundant visual."
VlogReward: Learning Multi-Dimensional Evaluation for Vlog Editing,Yexiang Liu; Wen Zhong; Sijie Zhu; Xin Gu; Fan Chen; Junxian Duan; Jie Cao; Longyin Wen; Zhenfang Chen,https://icml.cc/virtual/2026/poster/61914,Poster Session 7,"Focuses on vlog editing, vlog creators, vlogreward multi-dimensional, multi-dimensional vlog, and editing rapid."
VR-Thinker: Boosting Multimodal Reward Models through Think with Image Reasoning,Qunzhong Wang; Jie Liu; Jiajun Liang; Yuanxing Zhang; Yilei Jiang; Yaozhi ZHENG; Xintao Wang; Pengfei Wan; Xiangyu Yue; Jiaheng Liu,https://icml.cc/virtual/2026/poster/64656,,"Focuses on multimodal reward, visual reasoning, vr-thinker boosting, boosting multimodal, and reward think."
VSCD: Video-based Scene Change Detection in Unaligned Scenes,Jiae Yoon; Ue-Hwan Kim,https://icml.cc/virtual/2026/poster/62114,Poster Session 4,"Focuses on change detection, video-based scene, scene change, vscd video-based, and detection unaligned."
WeatherSyn: An Instruction Tuning MLLM For Weather Forecasting Report Generation,Zinan Zheng; Yang Liu; Nuo Chen; Juepeng Zheng; Hong Cheng; Jia Li,https://icml.cc/virtual/2026/poster/63486,Poster Session 8,"Focuses on weather forecasting, weather aspects, forecasting report, report generation, and weathersyn instruction."
WEVSR: Adapting Video Diffusion Generators to Real-World Video Super‑Resolution with Wavelet-Enhanced VAE Encoder,Yuying Chen; Liu; Linyan Jiang; Qifan Gao; Xianguo Zhang; Jianhou Gan; Wenqi Ren,https://icml.cc/virtual/2026/poster/63509,Poster Session 2,"Focuses on video diffusion, video super, super resolution, vae encoder, and wevsr adapting."
What Makes Synthetic Data Effective in Image Segmentation,Jinjin Zhang; Xiefan Guo; Yizhou jin; Nan Zhou; Di Huang,https://icml.cc/virtual/2026/poster/66156,Poster Session 6,"Focuses on synthetic images, makes synthetic, synthetic effective, effective image, and image segmentation."
When Attributes Disagree: Gradient Conflict in Image Aesthetic Assessment,Ye Wang; Maocai Dai; Jiang Xie; Xiuli Bi; Fei Tao; Xiao Li; Hong Yu,https://icml.cc/virtual/2026/poster/65091,Poster Session 2,"Focuses on gradient conflict, image aesthetic, aesthetic assessment, gradient routing, and attributes disagree."
Where Detectors Fail: Probing Generative Space for Generalizable AI-Generated Image Detection,Zijie Cao; Weijie Tu; Yao Xiao; Weijian Deng; Weiyan Chen; Liang Lin; Pengxu Wei,https://icml.cc/virtual/2026/poster/62485,Poster Session 3,"Focuses on unseen generators, standard sampling, detectors fail, fail probing, and probing generative."
WhisperSplat: Lossless Steganography in 3D Gaussian Splatting,Nicole Meng; Ronak Sahu; Miao Yin; Faysal Hossain Shezan; Yingjie Lao,https://icml.cc/virtual/2026/poster/64147,,"Focuses on whispersplat lossless, lossless steganography, steganography gaussian, gaussian splatting, and noise key."
World-R1: Reinforcing 3D Constraints for Text-to-Video Generation,Weijie Wang; Xiaoxuan He; Youping Gu; Zeyu Zhang; Yefei He; Yanbo Ding; Donny Y. Chen; Xirui Hu; Zhiyuan He; Yuqing Yang; Yifan Yang; Bohan Zhuang,https://icml.cc/virtual/2026/poster/61916,Poster Session 2,"Focuses on video generation, world simulation, world-r1 reinforcing, reinforcing constraints, and constraints text-to-video."
World-Shaper: A Unified Framework for 360° Panoramic Editing,Dong Liang; yuhao liu; Jinyuan Jia; Youjun Zhao; Rynson Lau,https://icml.cc/virtual/2026/poster/65232,Poster Session 2,"Focuses on world-shaper unified, panoramic editing, panoramic generation, unified panoramic, and editing able."
WorldCache: Accelerating World Models for Free via Heterogeneous Token Caching,Weilun Feng; Guoxin Fan; Haotong Qin; Chuanguang Yang; Mingqiang Wu; Yuqi Li; Xiangqi Li; Zhulin An; Libo Huang; Dingrui Wang; Longlong Liao; Michele Magno; Yongjun Xu,https://icml.cc/virtual/2026/poster/64550,Poster Session 4,"Focuses on heterogeneous token, diffusion world, worldcache accelerating, accelerating world, and world free."
Zero-shot Active Mapping via Fused 360-BEV Representations and Vision–Language Models,Yuanze Wang; Dianxi Shi; Yuetian Wang; Shiming Song; Haikuo Peng; Chunping Qiu; Mengzhu Wang,https://icml.cc/virtual/2026/poster/62065,Poster Session 7,"Focuses on active mapping, large-scale scenes, informative waypoints, depth-first exploration, and zero-shot active."
Zero-Shot Text-to-Motion Evaluation using Video Language Models,Yuwen Ji; Donglin Wang; Yue Zhang,https://icml.cc/virtual/2026/poster/63904,Poster Session 7,"Focuses on zero-shot text-to-motion, text-to-motion video, video language, language text-to-motion, and text-to-motion t2m."
Zooming without Zooming: Region-to-Image Distillation for Fine-Grained Multimodal Perception,Lai Wei; Liangbo He; jun lan; Lingzhong Dong; Yutong Cai; Siyuan Li; Huijia Zhu; Weiqiang Wang; Linghe Kong; Yue Wang; Zhuosheng Zhang; Weiran Huang,https://icml.cc/virtual/2026/poster/62952,Poster Session 6,"Focuses on fine-grained perception, region-to-image distillation, zooming region-to-image, distillation fine-grained, and fine-grained multimodal."
