title,authors,url,session,abstract_takeaway
RNA-FM: Flow-Matching Generative Model for Genome-wide RNA-Seq Prediction,Yaxuan Song; Jianan Fan; Tianyi Wang; Qiuyue Hu; Hang Chang; Heng Huang; Weidong Cai,https://icml.cc/virtual/2026/poster/60953,Poster Session 6,"Focuses on gene expression, rna-fm flow-matching, flow-matching generative, generative genome-wide, and rna-seq prediction."
Salus: Strategic Diagnostic Testing for Complex Diagnosis via Multi-Agent Reinforcement Learning,Shuohao Gao; Xuanzhong Chen; Lingxiao Luo; Zilin Ding; Rong Han; Rui Jiang; Ting Chen,https://icml.cc/virtual/2026/poster/64732,Poster Session 1,"Focuses on strategic diagnostic, multi-agent reinforcement, process clinician, diagnostic tests, and definitive diagnosis."
scDEBART: Predicting in silico Single-Cell Perturbation Responses via Large-Scale Differential Expression Learning,Jieun Sung; Wankyu Kim,https://icml.cc/virtual/2026/poster/61521,Poster Session 6,"Focuses on absolute expression, expression-change profiles, scdebart predicting, predicting silico, and silico single-cell."
SP-Mind: An Autonomous Reasoning Agent for Spatial Proteomics Analysis,YuCheng Yuan; Ji Yuanfeng; Zhongxiao Li; Ruijiang Li,https://icml.cc/virtual/2026/poster/63717,Poster Session 8,"Focuses on spatial proteomics, sp-mind autonomous, proteomics analysis, autonomous reasoning, and reasoning agent."
SpaEF: Spatially Resolved Transcriptomics Data Element-Wise Denoising Framework Powered by Large Models,Zekuan Shang; Xiaosong Han; Liupu Wang; Wei Du; Peng Zhao; Yuanshu Li; Yubin Xiao; Xuan Wu; You Zhou,https://icml.cc/virtual/2026/poster/64156,Poster Session 6,"Focuses on spot gene, gene graphs, spatially resolved, resolved transcriptomics, and construct spot."
Spherical Procrustes Alignment for Reliable Medical Audio Diagnosis,ying wang; Guoheng Huang; Chan-Tong Lam; Xiaochen Yuan,https://icml.cc/virtual/2026/poster/62817,Poster Session 2,"Focuses on procrustes alignment, medical audio, spherical procrustes, reliable medical, and audio diagnosis."
SPR-RAFT: Parameter-Efficient Regression-Aware Fine-Tuning for Biomedical LLM Regression,Yuanlin Yang; Chenhui Li; Xuhao Guo; ANQI ZHANG; Hoi Leong Lee; Haodong Liu,https://icml.cc/virtual/2026/poster/63748,,"Focuses on spr-raft parameter-efficient, parameter-efficient regression-aware, numerical reasoning, regression-aware fine-tuning, and fine-tuning biomedical."
Stabilizing In-Context Multi-Source Domain Adaptation for Biomedical Images Through Controls,Ana Sanchez Fernandez; Thomas Pinetz; Werner Zellinger; Günter Klambauer,https://icml.cc/virtual/2026/poster/61614,Poster Session 6,"Focuses on batch effects, domain adaptation, biomedical images, biological datasets, and training inference."
Structured Multi-modal Graph Disentanglement for Psychiatric Diagnosis,Hongyu Shi; Kaizhong Zheng; WS Zhai; Shuai Jiang; Liangjun Chen; Badong Chen,https://icml.cc/virtual/2026/poster/62853,Poster Session 1,"Focuses on multi-modal graph, structured multi-modal, graph disentanglement, cross-modal agreement, and agreement modality-specific."
SurvDiff: A Diffusion Model for Generating Synthetic Data in Survival Analysis,Marie Brockschmidt; Maresa Schröder; Stefan Feuerriegel,https://icml.cc/virtual/2026/poster/62922,Poster Session 6,"Focuses on generating synthetic, synthetic survival, survival analysis, clinical research, and censoring mechanism."
Time-Conditioned Foreseeing: An EHR-Specific Foundation Model for Irregular Dynamics and Calendrical Time,Bong Gyun Kang; JUNYONG AHN; Hyeongrok Han; Sungroh Yoon,https://icml.cc/virtual/2026/poster/64928,Poster Session 6,"Focuses on time-conditioned foreseeing, ehr foundation, foreseeing ehr-specific, ehr-specific foundation, and foundation irregular."
Towards Docking-oriented De Novo Ligand Design via Gradient Inversion,Zekai Chen; Xunkai Li; Sirui Zhang; Henan Sun; Jia Li; Qiangqiang Dai; Hongchao Qin; Zhenjun Li; Bing Zhou; Rong-Hua Li; Guoren Wang,https://icml.cc/virtual/2026/poster/66764,Poster Session 8,"Focuses on gradient inversion, novo ligand, protein molecule, differentiable surface, and surface modeling."
Towards Universal Gene Regulatory Network Inference: Unlocking Generalizable Regulatory Knowledge in Single-cell Foundation Models,Jiaxin Qi; Hang Li; Yan Cui; Yuhua Zheng; Jianqiang Huang,https://icml.cc/virtual/2026/poster/62747,,"Focuses on grn inference, gene regulatory, regulatory network, regulatory knowledge, and single-cell foundation."
Transitive Representation Learning Enhances Histopathology Annotation,Moritz Schaefer; Zoe Piran; Nils Philipp Walter; Animesh Awasthi; Christoph Bock; Jure Leskovec; Zinaida Good,https://icml.cc/virtual/2026/poster/63144,Poster Session 7,"Focuses on gene expression, transitive representation, single-cell gene, histopathology images, and representation enhances."
TSMGen: Target-Specific Molecule Generation via Higher-Order Structural Dependencies and Context-Aware Bidirectional Fusion,Yaoyu Chen; Xiaoli Lin; Ziyi Gong; Jun Pang,https://icml.cc/virtual/2026/poster/63863,Poster Session 2,"Focuses on structural information, protein pocket, target-specific molecule, molecule generation, and context-aware bidirectional."
TwinWeaver: An LLM-Based Foundation Model Framework for Pan-Cancer Digital Twins,Nikita Makarov; Maria Bordukova; Lena von Voithenberg; Estrella Pivel-Villanueva; Sabrina Mielke; Jonathan Wickes; Hanchen Wang; Mingyu Ma; Keunwoo Choi; Kyunghyun Cho; Stephen Ra; Raul Rodriguez-Esteban; Fabian Schmich; Michael Menden,https://icml.cc/virtual/2026/poster/61602,Poster Session 1,"Focuses on event prediction, twinweaver llm-based, llm-based foundation, foundation pan-cancer, and pan-cancer digital."
UniMedVL: Unifying Medical Multimodal Understanding and Generation through Observation-Knowledge-Analysis,Junzhi Ning; Wei Li; Cheng Tang; Jiashi Lin; Chenglong Ma; Chaoyang Zhang; Jiyao Liu; Ying Chen; Shujian Gao; Lihao Liu; Yuandong Pu; Huihui Xu; Chenhui Gou; Ziyan Huang; Yi Xin; Qi Qin; Zhongying Deng; Diping Song; Bin Fu; Guang Yang; Ji Yuanfeng; Tianbin Li; Yanzhou Su; Jin Ye; SHIXIANG TANG; Ming Hu; Junjun He,https://icml.cc/virtual/2026/poster/66054,Poster Session 8,"Focuses on understanding generation, image understanding, medical multimodal, multimodal understanding, and visual outputs."
