title,authors,url,session,abstract_takeaway
AIR-VLA: Vision-Language-Action Systems for Aerial Manipulation,Jianli Sun; Bin Tian; Qiyao Zhang; Chengxiang Li; Zihan Song; Zhiyong Cui; Yisheng Lv; Yonglin Tian,https://icml.cc/virtual/2026/poster/64411,Poster Session 5,"Focuses on aerial manipulation, vla paradigms, tailored aerial, air-vla vision-language-action, and vision-language-action systems."
Any3D-VLA: Enhancing VLA Robustness via Diverse Point Clouds,Xianzhe Fan; Shengliang Deng; Xiaoyang Wu; Yuxiang Lu; Zhuoling Li; Mi Yan; Yujia Zhang; Zhizheng Zhang; He Wang; Hengshuang Zhao,https://icml.cc/virtual/2026/poster/60472,Poster Session 5,"Focuses on point clouds, visual input, corresponding representations, domain gap, and any3d-vla enhancing."
AutoMoT: A Unified Vision-Language-Action Model with Asynchronous Mixture -of-Transformers for End-to-End Autonomous Driving,Wenhui (Oscar) Huang; Songyan Zhang; Qihang Huang; Zhidong Wang; zhiqi mao; Collister Chua; Chen Zhan; Long Chen; Chen Lv,https://icml.cc/virtual/2026/poster/64489,Poster Session 4,"Focuses on autonomous driving, reasoning action, general reasoning, reasoning capabilities, and automot unified."
Bring My Cup! Personalizing Vision-Language-Action Models with Visual Attentive Prompting,Sangoh Lee; Sangwoo Mo; Wook-Shin Han,https://icml.cc/virtual/2026/poster/62528,Poster Session 3,"Focuses on bring cup, visual attentive, attentive prompting, reference images, and cup personalizing."
CoIRL-AD: Collaborative-Competitive Imitation-Reinforcement Learning in Latent World Models for Autonomous Driving,Xiaoji Zheng; Ziyuan Yang; Yuhang PENG; Yanhao Chen; Yuanrong Tang; Gengyuan Liu; Bokui Chen; Jiangtao Gong,https://icml.cc/virtual/2026/poster/62362,Poster Session 3,"Focuses on autonomous driving, end-to-end autonomous, long-tail scenarios, coirl-ad collaborative-competitive, and collaborative-competitive imitation-reinforcement."
De4D-SLAM: Gradient-Isolated Static-Dynamic Decoupling for Monocular SLAM in Dynamic Environments,Zhicheng Fan; Zitong Wu; Zhaoxing Fan; Xiao Zhang; Biao Hou; Bo Ren,https://icml.cc/virtual/2026/poster/66049,,"Focuses on de4d-slam gradient-isolated, gradient-isolated static-dynamic, static-dynamic decoupling, decoupling monocular, and monocular slam."
DECO: Decoupled Multimodal Diffusion Transformer for Bimanual Dexterous Manipulation with a Plugin Tactile Adapter,Xukun Li; Yu Sun; Lei Zhang; Bo-Sheng Huang; Yibo Peng; Yuan Meng; Haojun Jiang; Shaoxuan Xie; Guocai Yao; Alois Knoll; Zhenshan Bing; Xinlong Wang; Zhenguo Sun,https://icml.cc/virtual/2026/poster/66358,Poster Session 3,"Focuses on bimanual dexterous, dexterous manipulation, deco decoupled, decoupled multimodal, and multimodal diffusion."
DecoVer: A Decompose-and-Verify Neuro-Symbolic Framework for Embodied Task Planning with BC+,YiXiang Jiang; Binqian Xu; Xiangbo Shu,https://icml.cc/virtual/2026/poster/63653,Poster Session 5,"Focuses on embodied task, task planning, decover decompose-and-verify, decompose-and-verify neuro-symbolic, and neuro-symbolic embodied."
DeepSight: Long-Horizon World Modeling via Latent States Prediction for End-to-End Autonomous Driving,Lingjun Zhang; Changjie Wu; Linzhe Shi; Jiangyang Li; Jiaxin Liu; Lei Yang; Hang Zhang; Mu Xu; Hong Wang,https://icml.cc/virtual/2026/poster/62484,Poster Session 5,"Focuses on autonomous driving, end-to-end autonomous, text reasoning, visual reasoning, and deepsight long-horizon."
DiLA: Disentangled Latent Action World Models,Tianqiu Zhang; Muyang Lyu; Yufan Zhang; Fang Fang; Si Wu,https://icml.cc/virtual/2026/poster/65662,Poster Session 5,"Focuses on latent action, action abstraction, dila disentangled, disentangled latent, and action world."
Dual-Stream Diffusion for World-Model Augmented Vision-Language-Action Model,John Won; Kyungmin Lee; Huiwon Jang; Dongyoung Kim; Jinwoo Shin,https://icml.cc/virtual/2026/poster/64447,Poster Session 5,"Focuses on dual-stream diffusion, world-model augmented, inference-time scaling, diffusion world-model, and augmented vision-language-action."
Dyn-VPP: Video Prediction Policy Optimization for Improved Visual Dynamics,Zirui Ge; Pengxiang Ding; Yemin Wang; BaoHuaYin; Qishen Wang; Zhiyong Xie; Hengtao Li; Runze Suo; Wenxuan Song; Han Zhao; Shangke Lyu; Haoang Li; RAN CHENG; Cheng Chi; Hui-Bin Ge; Yaozhi Luo; Donglin Wang,https://icml.cc/virtual/2026/poster/66506,Poster Session 3,"Focuses on visual dynamics, policy optimization, dyn-vpp video, video prediction, and prediction policy."
"Dynamics Are Learned, Not Told: Semi-Supervised Discovery of Latent Dynamics Geometries For Zero-Shot Policy Adaptation",Zhiming Xu; Weitao Zhou; Xianghui Pan; Chenpeng Yao; Nanshan Deng; Chengju Liu; Qijun Chen,https://icml.cc/virtual/2026/poster/63406,Poster Session 3,"Focuses on dynamics shifts, dynamics learned, learned told, told semi-supervised, and semi-supervised discovery."
EcoVLA: Environment-Aware Adaptive Pruning with Interleaved Inference Orchestration for Vision-Language-Action Models,Yuting Huang; Leilei Ding; Zhipeng Tang; Zenghuan Zhu; Jiajun Deng; Xinrui Lin; Shuo Liu; Haojie Ren; Jianmin Ji; Yanyong Zhang,https://icml.cc/virtual/2026/poster/66030,Poster Session 5,"Focuses on adaptive pruning, sparsity patterns, speedup only, ecovla environment-aware, and environment-aware adaptive."
Efficient Skill Grounding via Code Refactoring with Small Language Models,Sera Choi; Wonje Choi; Saehun Chun; Daehee Lee; Chaeun Lee; Jooyoung Kim; Honguk Woo,https://icml.cc/virtual/2026/poster/65138,Poster Session 5,"Focuses on skill grounding, small language, effective skill, grounding refactoring, and refactoring small."
Embodied-DETR: End-to-End Temporal 3D Object Detection in Egocentric Views,Ziheng Ding; Xiaze Zhang; Yuejie Zhang; lifeng chen; Rui Feng,https://icml.cc/virtual/2026/poster/63193,Poster Session 5,"Focuses on object detection, embodied-detr end-to-end, end-to-end temporal, accuracy temporal, and temporal object."
Embodiment-Conditioned Mixture of Experts Increases the Evolvability of Robots,Yibin Wang; Muhan Li; Zihan Guo; Sam Kriegman,https://icml.cc/virtual/2026/poster/62776,Poster Session 5,"Focuses on embodiment-conditioned mixture, mixture experts, experts increases, increases evolvability, and evolvability robots."
EnsembleVLA: Ensemble Learning for Vision-Language Action Models,Mingchen Song; Xiang Deng; Jie Wei; Dongmei Jiang; Liqiang Nie; Weili Guan,https://icml.cc/virtual/2026/poster/61698,Poster Session 3,"Focuses on ensemblevla ensemble, ensemble vision-language, vision-language action, action diverse, and diverse vision-language-action."
FlatLab: A Unified Methodology Framework and Simulation-Based Benchmark for Robotic Manipulation of Flat Objects,Xingyu Zhu; Wenshuo Han; Zhouyu Wang; Yuran Wang; Ruihai Wu; Hao Dong; Fan Tang; Hechang Chen; Hyung Jin Chang; Yixing Gao,https://icml.cc/virtual/2026/poster/66662,Poster Session 5,"Focuses on flat objects, robotic manipulation, manipulation flat, strategy generator, and execution module."
FocalPolicy: Frequency-Optimized Chunking and Locally Anchored Flow Matching for Coherent Visuomotor Policy,Qian He; Zhenshuo Yang; Wenqi Liang; Chunhui Hao; Nicu Sebe; Jiandong Tian,https://icml.cc/virtual/2026/poster/66520,Poster Session 3,"Focuses on locally anchored, flow matching, frequency-optimized chunking, chunking locally, and anchored flow."
From Abstraction to Instantiation: Learning Behavioral Representation for Vision-Language-Action Model,Bing Hu; Zaijing Li; Rui Shao; Junda Chen; April Hua Liu; Wei-Shi Zheng; Liqiang Nie,https://icml.cc/virtual/2026/poster/66596,Poster Session 5,"Focuses on behavior representations, abstraction instantiation, instantiation behavioral, behavioral representation, and representation vision-language-action."
From Imagined Futures to Executable Actions: Mixture of Latent Actions for Robot Manipulation,Yajie Li; Bozhou Zhang; Chun Gu; Zipei Ma; Jiahui Zhang; Jiankang Deng; Xiatian Zhu; Li Zhang,https://icml.cc/virtual/2026/poster/66091,,"Focuses on mixture latent, latent actions, robot manipulation, imagined futures, and predicted frames."
From Pixels to Tokens: A Systematic Study of Latent Action Supervision for Vision-Language-Action Models,Yihan Lin; Haoyang Li; Yang Li; Haitao Shen; Yihan Zhao; Chao Shao; Jing Zhang,https://icml.cc/virtual/2026/poster/63621,Poster Session 5,"Focuses on latent actions, action supervision, study latent, image-based latent, and action-based latent."
Functional Cache Grafting: Robust and Rapid Code-Policy Synthesis for Embodied Agents,Saehun Chun; Sera Choi; Wonje Choi; Sanghyun Ahn; Honguk Woo,https://icml.cc/virtual/2026/poster/62313,Poster Session 3,"Focuses on cache grafting, functional cache, embodied agents, prefill computation, and grafting robust."
Generalizable and Actionable Parts Pose Estimation with Symmetry Annotation-Free Learning Strategy,wenxiao chen; Xueyu Yuan; Liu Liu; Di Wu; Dan Guo,https://icml.cc/virtual/2026/poster/65375,Poster Session 5,"Focuses on generalizable actionable, actionable parts, pose estimation, parts pose, and symmetry annotation-free."
GeoSense: Internalizing Geometric Necessity Perception for Multimodal Reasoning,Ruiheng Liu; Haihong Hao; Mingfei Han; Xin Gu; Kecheng Zhang; Changlin Li; Xiaojun Chang,https://icml.cc/virtual/2026/poster/64060,Poster Session 3,"Focuses on empowering autonomously, geometric features, geosense internalizing, internalizing geometric, and geometric necessity."
LangForce: Bayesian Decomposition of Vision Language Action Models via Latent Action Queries,Shijie Lian; Bin Yu; Xiaopeng LIN; Laurence Yang; Zhaolong Shen; Changti Wu; YuZhuo Miao; Cong Huang; Kai Chen,https://icml.cc/virtual/2026/poster/65457,Poster Session 3,"Focuses on bayesian decomposition, language action, latent action, action queries, and mutual information."
Learning High-Frequency Continuous Action Chunks in Latent Space,Kunyun Wang; Yuhang Zheng; Jieru Zhao; Yupeng Zheng; Wenchao Ding,https://icml.cc/virtual/2026/poster/63021,Poster Session 3,"Focuses on action chunks, latent space, action chunking, execute complex, and high-frequency continuous."
Learning Human-Robot Collaboration via Heterogeneous-Agent Lyapunov Policy Optimization,Hao Zhang; Yaru Niu; Yikai Wang; Ding Zhao; Eric Tseng,https://icml.cc/virtual/2026/poster/61049,Poster Session 3,"Focuses on heterogeneous-agent lyapunov, lyapunov policy, policy optimization, human-robot collaboration, and collaboration heterogeneous-agent."
Learning to Reconfigure: Co-designing Reconfigurable robots for Heterogeneous Locomotion,Xiaoyu Xiong; Kehan Liu; HuiYi Yan; Shengjie Wang; Yang Gao; Tao Du,https://icml.cc/virtual/2026/poster/61720,Poster Session 3,"Focuses on reconfigurable robots, robots heterogeneous, heterogeneous locomotion, locomotion tasks, and co-design algorithms."
Making Learner Weakness Actionable for Learning from Demonstration with Novice Teachers,Yuqing Zhu; Matthew Howard,https://icml.cc/virtual/2026/poster/60789,Poster Session 3,"Focuses on novice teachers, making learner, learner weakness, weakness actionable, and actionable demonstration."
Mosaic: Runtime-Efficient Multi-Agent Embodied Planning,Kunjal Panchal; Saayan Mitra; Sunav Choudhary; Victor Bursztyn; Somdeb Sarkhel; Hui Guan,https://icml.cc/virtual/2026/poster/62291,,"Focuses on mosaic runtime-efficient, runtime-efficient multi-agent, multi-agent embodied, embodied planning, and state tracking."
Motion Planning in Compressed Representation Spaces,Lukas Lao Beyer; Sertac Karaman,https://icml.cc/virtual/2026/poster/65600,Poster Session 3,"Focuses on motion planning, latent space, flexibility efficiency, planning compressed, and compressed representation."
Move-Then-Operate: Behavioral Phasing for Human-Like Robotic Manipulation,Haoming Xu; Lei Lei; Jie Gu; Chu Tang; Jingmin Chen; Rui-Qi Wang,https://icml.cc/virtual/2026/poster/65496,Poster Session 3,"Focuses on robotic manipulation, move-then-operate behavioral, behavioral phasing, phasing human-like, and human-like robotic."
MSP: Probabilistically Consistent Multi-Scale Action Generation,Zhixuan Lin; Gengqi Liu; Chao Zheng; Gao Lin; Jindong Yu; Song Gao; Fei Wang,https://icml.cc/virtual/2026/poster/60482,,"Focuses on probabilistically consistent, action generation, consistent multi-scale, multi-scale action, and long-horizon tasks."
MVISTA-4D: View-Consistent 4D World Model with Test-Time Action Inference for Robotic Manipulation,Jiaxu Wang; JIANG Yicheng; Tianlun HE; Jingkai SUN; Qiang Zhang; Jiahang Cao; Zesen Gan; Mingyuan Sun; Qiming Shao; Xiangyu Yue,https://icml.cc/virtual/2026/poster/65571,Poster Session 3,"Focuses on test-time action, robotic manipulation, inverse dynamics, mvista-4d view-consistent, and view-consistent world."
MVP-LAM: Learning Action-Centric Latent Action via Cross-Viewpoint Reconstruction,Jung Min Lee; Dohyeok Lee; Seokhun Ju; Taehyun Cho; Jin Koo; Li Zhao; Sangwoo Hong; Jungwoo Lee,https://icml.cc/virtual/2026/poster/61359,Poster Session 3,"Focuses on latent actions, action-centric latent, cross-viewpoint reconstruction, reconstruction latent, and vla pretraining."
N2M: Bridging Navigation and Manipulation by Learning Pose Preference from Rollout,Kaixin Chai; Hyunjun Lee; Joseph Lim,https://icml.cc/virtual/2026/poster/60605,Poster Session 3,"Focuses on base positioning, n2m bridging, bridging navigation, navigation manipulation, and manipulation pose."
Neural Implicit Action Fields: From Discrete Waypoints to Continuous Functions for Vision-Language-Action Models,Haoyun Liu; Jianzhuang Zhao; Xinyuan Chang; Tianle Shi; Chuanzhang Meng; Jiayuan Tan; Feng Xiong; Tong Lin; Dongjie Huo; Mu Xu; SongLin Dong; Zhiheng Ma; Yihong Gong; Sheng Zhong,https://icml.cc/virtual/2026/poster/64538,Poster Session 5,"Focuses on discrete waypoints, neural implicit, implicit action, action fields, and waypoints continuous."
NeurVLA: Unleashing Failure-Handling Capability of Vision-Language-Action Models via Neural-Symbolic Reasoning,Xuqi Liu; Minghe Gao; Juncheng Li; Siliang Tang,https://icml.cc/virtual/2026/poster/63650,Poster Session 3,"Focuses on neural-symbolic reasoning, generalization diverse, failure correction, neurvla unleashing, and unleashing failure-handling."
NOMAD: Lifelong Trajectory Planning via Non-Parametric Bayesian Memory-Adaptive Diffusion Experts,Yixian Chen; Rufan Bai; Jiangbin Zheng; Yimin Wang; Tiantian CHEN; Wei Wang; Yuhuan Lu,https://icml.cc/virtual/2026/poster/62636,Poster Session 5,"Focuses on long-tail scenarios, trajectory planning, nomad lifelong, lifelong trajectory, and non-parametric bayesian."
OMP: One-step Meanflow Policy with Directional Alignment,Han Fang; Yize Huang; Yuheng Zhao; Paul Weng; Xiao Li; Yutong Ban,https://icml.cc/virtual/2026/poster/66693,Poster Session 8,"Focuses on one-step meanflow, meanflow policy, directional alignment, omp one-step, and policy directional."
On the Sample Efficiency of Inverse Dynamics Models for Semi-Supervised Imitation Learning,Sacha Morin; Moonsub Byeon; Alexia Jolicoeur-Martineau; Sebastien Lachapelle,https://icml.cc/virtual/2026/poster/66034,Poster Session 3,"Focuses on sample efficiency, inverse dynamics, semi-supervised imitation, behavior cloning, and idm labeling."
PACT: Self-Evolving Physical Safety Alignment for Diffusion Policies in Embodied Manipulation,Lingxuan Wu; Zijian Zhu; Lizhong Wang; Chengyang Ying; Huayu Chen; Xiao Yang; Fangming Liu; Jun Zhu,https://icml.cc/virtual/2026/poster/62679,Poster Session 3,"Focuses on diffusion policies, pact self-evolving, physical safety, safety alignment, and embodied manipulation."
"Plan in Sandbox, Navigate in Open Worlds: Learning Physics-Grounded Abstracted Experience for Embodied Navigation",Zhixuan Shen; Jiawei Du; Ziyu Guo; Han Luo; Lilan Peng; Joey Tianyi Zhou; Haonan Luo; Tianrui Li,https://icml.cc/virtual/2026/poster/63554,Poster Session 5,"Focuses on embodied navigation, plan sandbox, sandbox navigate, navigate worlds, and worlds physics-grounded."
Plug-and-Play Label Map Diffusion for Universal Goal-Oriented Navigation,Zhixuan Shen; Yijie Zeng; Shengxiang Luo; Tianrui Li; Haonan Luo,https://icml.cc/virtual/2026/poster/61342,Poster Session 5,"Focuses on plug-and-play label, label map, map diffusion, goal-oriented navigation, and semantic maps."
Position: Embodied AI Requires a Privacy-Utility Tradeoff,Xiaoliang Fan; jiarui chen; Zhuodong Liu; Ziqi Yang; Peixuan Xu; Ruimin Shen; Junhui Liu; Jianzhong Qi; Cheng Wang,https://icml.cc/virtual/2026/poster/67165,Poster Session 7,"Focuses on eai life, position embodied, embodied privacy-utility, privacy-utility tradeoff, and tradeoff embodied."
RA-VLA: Retrieval-Augmented VLA for Test-Time Adaptation,Sanghwan Jang; Minjin Jeon; Minsoo Kim; Seong Jin Choi; Dongha Kim; Hwanjo Yu,https://icml.cc/virtual/2026/poster/60980,,"Focuses on ra-vla retrieval-augmented, retrieval-augmented vla, vla test-time, test-time adaptation, and adaptation vision-language-action."
Reflex: Real-Time Vision-Language-Action Control through Streaming Inference,Yuanchun Guo; Bingyan Liu,https://icml.cc/virtual/2026/poster/63338,Poster Session 5,"Focuses on reflex real-time, streaming inference, inference flow, flow matching, and real-time vision-language-action."
RoboMME: Benchmarking and Understanding Memory for Robotic Generalist Policies,Yinpei Dai; Hongze Fu; Jayjun Lee; Yuejiang Liu; Haoran Zhang; Jianing Yang; Chelsea Finn; Nima Fazeli; Joyce Chai,https://icml.cc/virtual/2026/poster/65933,Poster Session 3,"Focuses on long-horizon history-dependent, manipulation tasks, memory representations, robomme benchmarking, and benchmarking understanding."
SCALE: Self-uncertainty Conditioned Adaptive Looking and Execution for Vision-Language-Action Models,Hyeonbeom Choi; Daechul Ahn; Youhan Lee; Taewook Kang; Seongwon Cho; Jonghyun Choi,https://icml.cc/virtual/2026/poster/66066,Poster Session 5,"Focuses on additional training, perception action, scale self-uncertainty, self-uncertainty conditioned, and conditioned adaptive."
Scaling by Diversified Experience for Vision-Language-Action Models,Leiyu Wang; Zhaofengnian Wang; Xueqi Li; Luoyi Fan; Cewu Lu; Nanyang Ye,https://icml.cc/virtual/2026/poster/62749,Poster Session 3,"Focuses on scaling diversified, diversified experience, experience vision-language-action, vision-language-action face, and face challenges."
SceneSmith: Agentic Generation of Simulation-Ready Indoor Scenes,Nicholas Pfaff; Thomas Cohn; Sergey Zakharov; Rick Cory; Russ Tedrake,https://icml.cc/virtual/2026/poster/63465,Poster Session 3,"Focuses on simulation-ready indoor, scenesmith agentic, agentic generation, generation simulation-ready, and indoor scenes."
See What Matters: Differentiable Grid Sample Pruning for Generalizable Vision-Language-Action Model,Yixu Feng; Zinan Zhao; Yanxiang Ma; Chenghao Xia; Chengbin Du; Yunke Wang; Chang Xu,https://icml.cc/virtual/2026/poster/65010,Poster Session 3,"Focuses on differentiable grid, visual tokens, see matters, matters differentiable, and grid sample."
Seeing Realism from Simulation: Efficient Video Transfer for Vision-Language-Action Data Augmentation,Chenyu Hui; Xiaodi Huang; Siyu Xu; Yunke Wang; Shan You; Fei Wang; Tao Huang; Chang Xu,https://icml.cc/virtual/2026/poster/61416,Poster Session 3,"Focuses on simulation video, video transfer, seeing realism, realism simulation, and transfer vision-language-action."
Self-CriTeach: LLM Self-Teaching and Self-Critiquing for Improving Robotic Planning via Automated Domain Generation,Jinbang Huang; Zhiyuan Li; Yuanzhao Hu; Zhanguang Zhang; Mark Coates; Xingyue Quan; Yingxue Zhang,https://icml.cc/virtual/2026/poster/65454,Poster Session 3,"Focuses on planning domains, structured reward, self-criteach llm, llm self-teaching, and self-teaching self-critiquing."
Sentinel-VLA: A Metacognitive VLA Model with Active Status Monitoring for Dynamic Reasoning and Error Recovery,Wenhao Li; Xiu Su; Dan Niu; Yichao Cao; Hongyan Xu; Zhe Qu; Lei Fan; Shan You; Chang Xu,https://icml.cc/virtual/2026/poster/61750,Poster Session 3,"Focuses on sentinel-vla metacognitive, metacognitive vla, status monitoring, dynamic reasoning, and error recovery."
SkillNet: Hierarchical Skill Modeling for Compositional Generalization in Vision-Language Action Models,Senwei Xie; Yuntian Zhang; Zhenzhou Tan; Ruiping Wang; Pengwei Wang; Shanghang Zhang; Xilin Chen,https://icml.cc/virtual/2026/poster/65559,Poster Session 3,"Focuses on skill attributes, compositional generalization, vision-language action, transferable skill, and hierarchical way."
SPUR: Scale-Partitioned Uncertainty Rectification for Robust UAV-on-UAV Interception,Chenqi Yan; Zhaoyu Zeng; Yifeng Yang; Jundong Zhou; Zhuoyuan Ni; Junqi Wu; Qinying Gu; Xinbing Wang; Nanyang Ye,https://icml.cc/virtual/2026/poster/64906,Poster Session 5,"Focuses on spur scale-partitioned, scale-partitioned uncertainty, uncertainty rectification, rectification robust, and robust uav-on-uav."
STEP: Warm-Started Visuomotor Policies with Spatiotemporal Consistency Prediction,Jinhao Li; Yuxuan Cong; Yingqiao Wang; Hao Xia; Shan Huang; Yijia Zhang; Ningyi Xu; Guohao Dai,https://icml.cc/virtual/2026/poster/61717,Poster Session 3,"Focuses on real-world tasks, spatiotemporal consistency, consistency prediction, inference latency, and success rate."
TapSampling: Inference-Time Sampling with a Task-Progress-Understanding Verifier for Robotic Manipulation,Sizhe Zhao; Shengping Zhang; Shuo Yang; Weiyu Zhao; Shuigen Wang; Xiangyang Ji,https://icml.cc/virtual/2026/poster/60500,Poster Session 5,"Focuses on inference-time sampling, embodied control, tapsampling inference-time, sampling task-progress-understanding, and task-progress-understanding verifier."
Temporal Difference Calibration in Sequential Tasks: Application to Vision-Language-Action Models,Shelly Francis-Meretzki; Mirco Mutti; Yaniv Romano; Aviv Tamar,https://icml.cc/virtual/2026/poster/63834,Poster Session 1,"Focuses on sequential tasks, temporal difference, difference calibration, calibration sequential, and tasks application."
The Lie We Tell: Correcting the Euclidean Fallacy in Vision Language Action Policies via Score Matching on Tangent Space,Bing-Cheng Chuang; I-Hsuan Chu; Bor Jiun Lin; Yang YuanFu; Min Sun; Chun-Yi Lee,https://icml.cc/virtual/2026/poster/64672,Poster Session 2,"Focuses on euclidean fallacy, tangent space, manifold drift, lie tell, and tell correcting."
TIC-VLA: A Think-in-Control Vision-Language-Action Model for Robot Navigation in Dynamic Environments,Zhiyu Huang; Yun Zhang; Johnson Liu; Rui Song; Chen Tang; Jiaqi Ma,https://icml.cc/virtual/2026/poster/65809,,"Focuses on navigation dynamic, dynamic environments, action generation, tic-vla think-in-control, and think-in-control vision-language-action."
Turning Adaptation into Assets: Cross-Domain Bridging for Online Vision-Language Navigation,Zixuan Hu; Xuantuo Huang; Yancheng Li; Yichun Hu; Shengyong Xu; LINGYU DUAN,https://icml.cc/virtual/2026/poster/63184,Poster Session 3,"Focuses on turning adaptation, adaptation assets, assets cross-domain, cross-domain bridging, and bridging online."
UniMapping: Unified SLAM Framework for Map-Centric Embodied Perception,Xiaze Zhang; Ziheng Ding; Yuejie Zhang; lifeng chen; Rui Feng,https://icml.cc/virtual/2026/poster/62962,Poster Session 3,"Focuses on unimapping unified, unified slam, slam map-centric, map-centric embodied, and embodied perception."
Vision-Language-Action Pretraining from Large-Scale Human Videos,Hao Luo; Yicheng Feng; Wanpeng Zhang; Sipeng Zheng; Ye Wang; Haoqi Yuan; jiazheng liu; Chaoyi Xu; Haiweng Xu; Qin Jin; Zongqing Lu,https://icml.cc/virtual/2026/poster/62813,Poster Session 5,"Focuses on human videos, vision-language-action pretraining, pretraining large-scale, large-scale human, and videos vision-language-action."
VLA-ATTC: Adaptive Test-Time Compute for VLA Models with Relative Action Critic Model,Wenhao Li; Xiu Su; Yichao Cao; Hongyan Xu; Xiaobo Xia; Shan You; Yi Chen; Chang Xu,https://icml.cc/virtual/2026/poster/61157,Poster Session 5,"Focuses on adaptive test-time, test-time compute, relative action, action critic, and vla-attc adaptive."
VLANeXt: Recipes for Building Strong VLA Models,Xiao-Ming Wu; Bin Fan; Kang Liao; Jian-Jian Jiang; Runze Yang; Yihang Luo; Zhonghua Wu; Wei-Shi Zheng; Chen Change Loy,https://icml.cc/virtual/2026/poster/64465,Poster Session 5,"Focuses on building strong, strong vla, vlanext recipes, recipes building, and vla following."
When Replanning Becomes the Bottleneck: Budgeted Replanning for Embodied Agents,Shuaijun Liu; Feiyang You; Xingwei Chen; Ningxin Su,https://icml.cc/virtual/2026/poster/63603,Poster Session 5,"Focuses on embodied agents, replanning embodied, each replanning, replanning call, and replanning latency."
XR-1: Towards Versatile Vision-Language-Action Models via Learning Unified Vision-Motion Representations,Shichao Fan; Kun Wu; Zhengping Che; Xinhua Wang; Di Wu; Fei Liao; Ning Liu; Yixue Zhang; Zhen Zhao; Zhiyuan Xu; Meng Li; Qingjie Liu; Shanghang Zhang; Min Wan; Jian Tang,https://icml.cc/virtual/2026/poster/64826,Poster Session 5,"Focuses on unified vision-motion, robotic datasets, heterogeneous sources, robot embodiments, and visual dynamics."
Zero-Shot 3D Question Answering via Hierarchical View-to-Token Transportation,Dongsheng Wang; Dawei Su; Hui Huang,https://icml.cc/virtual/2026/poster/63796,Poster Session 5,"Focuses on input context, key tokens, zero-shot question, question answering, and answering hierarchical."
